nama,npsn,bentuk_pendidikan,alamat_jalan,desa_kelurahan,kode_wilayah,kode_pos,latitude,longitude,nomor_telepon,nomor_fax,email,website,status_sek
TK Islam Syarif Hidayatullah,20111520,1,JL. ROSS BARAT III NO. 33,Bukit Duri,16309,,0,0,,,,,2
TK Islam Syarif Hidayatullah 01,20109793,1,JL. DR. KRT. RADJIMAN WIDYODININGRAT RT 05/06 NO. 34,,16408,13920,0,0,021-92899892,,Yayasansyarifhidayatullah@yahoo.com,,2
TK Islam Syofia,20110432,1,JL. B/I CEMAPAKA WARNA,Rawasari,16005,,0,0,,,,,2
TK Islam Taman Indah,20110196,1,JL. KESADARAN III GG. IKHLAS NO. 32 RT 05/01 CIPINANG MUARA,Cipinang Muara,16406,,0,0,021-8500776,,tamanindah84@gmail.com,,2
TK Islam Terpadu Al Furqon,69960432,1,Jl. Swasembada Timur XIX No.9 RT.012/005,Kebon Bawang,16103,14320,0,0,021-43931043,,alfurqon20@gmail.com,,2
TK Islam Terpadu Al Ittihaad,69831007,1,TEBET MAS INDAH I,Tebet Barat,16309,12810,0,0,021-8354791,218354791,tkit@al-ittihaad-tebet.or.id,http://al-ittihaad-tebet.or.id/tkit,2
TK Islam Terpadu Al Muhajirin,69959391,1,Jl. Cempaka Baru I No.17 RT.012 RW.006,Cempaka Baru,16006,,0,0,,,,,2
TK Islam Terpadu Al-Ittihaad,69785841,1,TEBET MAS INDAH 1,Tebet Barat,16309,,0,0,,,,,2
TK Islam Terpadu Ar Ridho,20111987,1,JL. PONDOK KELAPA XII BLOK G4/10,Pondok Kelapa,16407,13450,0,0,021-8641195,218650571,tkitarridho@gmail.com,,2
TK Islam Terpadu Assalaam,20111988,1,JL. NAKULA RAYA BLOK Q/3,Duren Sawit,16407,,0,0,,,,,2
TK Islam Terpadu Aulia,20178218,1,JL. CEMPAKA BARU VII NO. 7,Cempaka Baru,16006,,0,0,,,,,2
TK Islam Terpadu Fatharani,69820362,1,Jl. Cempaka Baru Tengah No.31 RT.08 RW.06,Cempaka Baru,16006,10640,0,0,021-4256902,214256902,tkitfatharani@gmail.com,,2
TK Islam Terpadu Fatharani,20109911,1,JL. CEMPAKA BARU TENGAH NO.31RT.008/06 KEL. CEMP. BARU KEC. KEMAYORAN JAKARTA P,Cempaka Baru,16006,,0,0,,,,,2
TK Islam Terpadu Raudhatul Ulum,69892692,1,Jl. H. Mading Kebon Kelapa No.58 RT.006/02,Kembangan Utara,16201,,0,0,,,,,2
TK Islam Terpadu Talenta Kids,69960603,1,Jl. Raya Lenteng Agung No. 39,Lenteng Agung,16301,,0,0,,,,,2
TK Islam Terpadu Ulul Ilmi,20110433,1,JL. KARET PS. BARU BARAT II RT.006/,Kelurahan Karet Tengsin,16001,,0,0,,,,,2
TK Islam Terpau Taman Ibadah,69908065,1,Jl. Tomang Asli No.31 RT.007/03,Jati Pulo,16203,,0,0,,,,,2
TK Islam Toledo,20111989,1,JL. LAPAN NO.25,Pekayon,16401,13710,0,0,021-87710689,,tkislamtoledo925@gmail.com,,2
TK Islam Tsaqofah Islamiyyah 3,20111521,1,JL. ROS TIMUR IV NO. 31,Bukit Duri,16309,12840,0,0,,,,,2
TK Islam Tugasku,20109682,1,JL.PULOMAS JAYA NO.2,Pulomas,16409,,0,0,,,,,2
TK Islam Tunas Bangsa,69830759,1,JL. JAHA NO. 1 RT. 9 RW. 1,Cilandak Timur,16302,12560,0,0,021-7816232,,,,2
TK Islam Tunas Harapan,69830866,1,Jalan Masjid Darul Falah No. 8,Petukangan Utara,16304,12260,-6.234546,106.75151,021-7356364,,tkislamtunasharapan@gmail.com,http://tkislamtunasharapan.com,2
TK Islam Tunas Harapan,69785743,1,JL.MASJID DARUL FALAH,Petukangan Utara,16304,,0,0,,,,,2
TK Islam Tunas Kafah,20109622,1,JL. SIUNG. KAV. KOWILHAN II BLOK 6/16 Kel. Setu  kec. Cipayung,Setu,16403,13880,0,0,0812-83409843,,romlahmo27@gmal.com,,2
TK Islam Tunas Mekar,20111990,1,JL. LINGKAR,Duren Sawit,16407,13440,-6.2263,106.9152,021-86606968,,baiturrahmandurensawit@gmail.com,http://yayasanbaiturrahman.com,2
TK Islam Udzri,20109967,1,JL. TELAGA III RT 13/09 NO. 45 GANDARIA,Pekayon,16401,13710,-6.2949,106.8558,021-95148393,,tkislamudzri@gmail.com,,2
TK Islam Uswatun Hasanah,20110181,1,JL. PEDATI TIMUR DALAM RT. 012/09 NO. 13,Rawa Bunga,16406,,0,0,,,,,2
TK Islam Wahyu Bhakti,20110139,1,JL. CENTEX NO. 28 CIRACAS,Ciracas,16402,13740,0,0,021-87715919,218711169,tk.islamwahyubhakti@gmail.com,,2
TK Islam Yasiru,20110998,1,JL. PAHLAWAN III RT.002/05 NO.46,Sukabumi Selatan,16202,11560,0,0,021-51261223,,tkislamyasiru@gmail.com,,2
TK Islam Ykpi,69856827,1,Jl. Angke Jaya No.10,Angke,16205,11330,-6.148566,106.798541,0813-15259786,,tkislamykpi@gmail.com,,2
TK Islam Ykpi,20110997,1,JL. ANGKE JAYA NO. 10,Angke,16205,,0,0,,,,,2
TK Islam Ymb,20110434,1,Jl. Kramat Pulo Gundul No. K.103 D,Johar Baru,16004,,0,0,,,,,2
TK Islamic Centre,20109598,1,JL. RAYA CILANGKAP GG. HIKMAH NO.17A,,16403,,0,0,,,,,2
TK Islamsari Pembangunan,20111522,1,JL. RANCO INDAH NO. 30,Tanjung Barat,16301,,0,0,,,,,2
TK Istana Pelangi,20111991,1,JL. PONDOK KELAPA SELATAN,Pondok Kelapa,16407,,-6.252303,106.936914,,,,,2
TK Istiqomah,20111523,1,JL. TANAH KUSIR,Kebayoran Lama Utara,16305,,0,0,,,,,2
TK Istiqomah,69786009,1,DELMAN INDAH 3,Kebayoran Lama Utara,16305,,0,0,,,,,2
TK Istiqomah Tanah Kusir,69830901,1,Jln. Delman Indah III,Kebayoran Lama Utara,16305,12240,0,0,,,,,2
TK It A Ba Ta Srengseng,20111306,1,JL. SRENGSENG RAYA NO. 45,Maruya Srengseng,16201,11630,0,0,021-5865952,,,http://abata.sch.id,2
TK It Abata,69832168,1,Srengseng Raya No.45,Srengseng,16201,,0,0,,,,,2
TK It Adzkia,69790713,1,Letjen S.Parman I No. 7,Tomang,16204,11440,-6.171884,106.790693,021-5659781,,nahrowi_usri@yahoo.com,,2
TK It Al Hujjah,69832173,1,raya Taman Kota Rt. 016/05,Kembangan Utara,16201,11610,-6.158839,106.75704,0812-95039015,,tkitalhujjahtamkot@gmail.com,,2
TK It Al Idzhaar,20110977,1,JL.H.SALIHUN NO.163,Kebon Jeruk,16202,,0,0,,,,,2
TK It Al Khairaat,20110150,1,JL. MESJID CONDET  NO. 57 RT 16/03 BATU AMPAR,Batu Ampar,16405,,0,0,,,,,2
TK It Al Manar,69896453,1,Jalan Graha II Bumi Pesanggrahan Mas,Petukangan Selatan,16304,22710,-6.242801,106.748604,021-83943742,,tkitalmanar04@gmail.com,,2
TK It Al Muhajirin,69959580,1,"Jl. Zeni, KPAD RT.04/05, Jatiwaringin",Cipinang Melayu,16404,13620,0,0,0818-07320220,,tkam.kpad16@gmail.com,,2
TK It Al-Istiqomah,20109815,1,KP. PISANGAN RT. 12/03 NO. 34 PENGGILINGAN,,16408,13940,0,0,,,,,2
TK It Al-Istiqomah,20112258,1,Jl. Pisangan RT.012 03 No.34,Penggilingan,16408,,0,0,,,,,2
TK It Al-Mughni,20111714,1,JL. JEND. GATOT SUBROTO KAV. 26,Kuningan Timur,16310,,0,0,,,,,2
TK It An-Nur,20110085,1,JALAN M. SARBINI RT 09/04 NO. 61 BALEKAMBANG,Balekambang,16405,,0,0,,,,,2
TK It Ar-Rahman,20111486,1,JL. PALEM I NO. 45A,Petukangan Utara,16304,,0,0,,,,,2
TK It As-Saadah,20110016,1,JL. KIRAI INDAH NO.11 A RT 06/10,Kalisari,16401,13790,-6.332749,106.85498,,,,,2
TK It Assalaam,20112455,1,JL. NAKULA RAYA BLOK Q NO.1 KAV. DUREN SAWIT,Duren Sawit,16407,,0,0,,,,,2
TK It Assyairiyah,20109809,1,JL. RAYA PENGGILINGAN RT 05/11 NO. 2 CAKUNG,,16408,13940,0,0,0878-84315216,,aisyah.assyairiyah@gmail.com,,2
TK It Buah Hati,20110017,1,JL. DERMAGA NO.19 RT.10/03,Bale Kambang,16405,,-6.297754,106.860081,0882-10177686,,buahhati148@gmail.com,http://tkitbuahhati.com,2
TK It Cahaya Islam,20110978,1,JL.SATRIA  III NO.1B,Jelambar,16204,11460,-6.163841,106.788139,0878-77758885,,yayasankaaffah@gmail.com,,2
TK It Citra Az Zahra,69790676,1,Taman Alfa Indah Blok G1 Rt. 012/05,Joglo,16201,11640,0,0,021-58905727,215857976,sitcitraazzahra@gmail.com,http://citraazzahra.sch.id,2
TK It Citra Azzahra,69856698,1,TAMAN ALFA INDAH BLOK G1,Joglo,16201,11640,0,0,021-58905727,215857976,sitcitraazzahra@gmail.com,http://citraazzahra.sch.id,2
TK It Darul Athfal,20110979,1,JL.ANGREK CAKRA KEBON JERUK,Kebon Jeruk,16202,,0,0,,,,,2
TK It Fajar Islam,69945037,1,Jl. Mutiara No.32 RT.002 RW.003,Sumur Batu,16006,10640,0,0,021-2463882,,Fajarislam14@yahoo.com,,2
TK It Fathan Mubina,20110189,1,JLN. OTISTA RAYA NO. 448/449 RT 003/012 BIDARA CINA,Bidara Cina,16406,13330,0,0,021-8194158,,etyedy20@gmail.com,,2
TK It Ibnu Sabil,20109667,1,JL. PISANGAN BARU TENGAH  RT 13/07 NO. 317,Pisangan Baru,16410,13110,0,0,021-85904112,,,,2
TK It Insan Madani,20110321,1,JL. PERINDUSTRIAN V NO. 43 RT 04/06 KEBON PALA,Kebon Pala,16404,13650,-6.250587,106.876996,021-80889687,,tkitinsanmadani05@gmail.com,,2
TK It Mishbahul Amal,20111931,1,JL. CIPINANG JAYA II E RT 09 RW 09,Cipinang Besar Selatan,16406,13410,0,0,021-98257380,,,,2
TK It Nur Rahman,20109770,1,JL. KAYU TINGGI GG. KUTILANG NO. 10 RT.07/05,,16408,13910,0,0,021-4606581,,,,2
TK It Permata Bunda,20109645,1,JL.GALUR SARI RAYA BLOK J NO. 192 B,Utan Kayu Selatan,16410,13120,-6.2004,106.8677,021-8500238,,,,2
TK It Rahmatusy Syifa,20109832,1,JL. RAWA KUNING RT. 10/07 PULO GEBANG CAKUNG,,16408,13930,0,0,0812-12808010,,,,2
TK It Ridwan,20110086,1,JALAN. TK. RIA GG. GADING NO. 12 RT 07/02,Tengah,16405,,0,0,,,,,2
TK It Riyadhush Shalihin,20110223,1,JLN. TANJUNG LENGKONG RT 13/07 NO. 15 BIDARACINA,Bidaracina,16406,13330,0,0,021-8199368,,riyadhush.shalihin@gmail.com,,2
TK It Sahabat,20110322,1,JL. SAHABAT CIPINANG ASEM VINO. 32 RT.03 RW.02 KEBON PALA MAKASAR JAKARTA TIMUR,Kebon Pala,16404,13650,0,0,021-8005090,,tkisahabat@gmail.com,,2
TK It Taman Ibadah,69870239,1,JL.TOMANG ASLI NO 31 RT 007/03,Jati Pulo,16203,11430,-6.178561,106.80375,0838-90810360,,susianie17@gmail.com,,2
TK Izzatul Jannah,20109821,1,PULO GEBANG PERMAI BLOK C 6 NO. 12 RT 04/09,,16408,13950,0,0,021-48702258,2148702258,azizah.pgp@gmail.com,http://alizzah.com,2
TK Jac,69795472,1,Jl. Kelapa Nias Raya Blok QB 2 No.1,Kelapa Gading Barat,16105,,0,0,,,,,2
TK Jac Kelapa Gading,69857076,1,Jl. Pegangsaan Dua No 75A,Kelapa Gading Barat,16105,14250,0,0,021-22860988,2122860989,info@jacschool.com,http://jacschool.com,2
TK Jac Sherwood,69903477,1,"Apt Sherwood Jl. Kelapa Nias Nlok GN, Tower RichMond Lantai GF, Lt I",Pegangsaan Dua,16105,14240,0,0,021-29616186,2129616187,tkjac.sw@jacschool.com,http://jacschool.com,2
TK Jakarta Islamic School,69892605,1,"Jl. Rudal V blok O1 Rt.001/006, Kavling Hankam Joglo, Jakarta Barat",Joglo,16201,,0,0,021-5844878,,,http://jakartaislamicschool.com,2
TK Jakarta Islamic School (Jisc),69820780,1,Jalan Inspeksi No.1 Curug Kalimalang,Pondok Kelapa,16407,,0,0,021-86610161,2186612154,kindyjisc1@gmail.com,http://JakartaIslamicSchool.com,2
TK Jakarta World Academy,69921073,1,JL. MH. THAMRIN NO.10 KELURAHAN KEBON MELATI KEC. TANAH ABANG,Gelora,16001,,0,0,,,,,2
TK Jamiat Kheir Pusat,20110436,1,JL. KEBON KACANG 41 NO. 19,Kelurahan Kebon Kacang,16001,10240,0,0,021-3158874,213162824,TKJKpusat@gmail.com,,2
TK Janti,20110437,1,JL. DAKOTA 5 A/101-104 KBBK,Kelurahan Kebon Kosong,16006,,0,0,,,,,2
TK Jatinegara Timur,20110215,1,JALAN JATINEGARA TIMUR NO. 61-65,Jatinegara,16406,,0,0,,,,,2
TK Jatinegara Timur,20111992,1,Jl. Jatinegara Timur No. 65,Bali Mester,16406,,0,0,,,,,2
TK Jauharotul Huda,69857115,1,ROROTAN III RT 12 RW 10,Rorotan,16106,14140,-6.153518,106.95228,021-44851063,,tk.jauharotulhuda@gmail.com,,2
TK Jauharotul Huda,20109768,1,TAMBUN RENGAS RT 06/07 CAKUNG TIMUR,,16408,13910,0,0,0857-71589079,,tkislam.jauharotulhuda@gmail.com,,2
TK Jauharotul Huda,69795431,1,Jl. Rorotan III,Rorotan,16106,,0,0,,,,,2
TK Jauhaurotul Huda,20110676,1,JL. ROROTAN III,Rorotan,16106,,0,0,,,,,2
TK Jauza,20111525,1,JL. TANJUNG BARAT SELATAN NO. 50,Tanjung Barat,16301,,0,0,,,,,2
TK Jaya Karya,69832189,1,K S Tubun I No.14,Kota Bambu Selatan,16203,,0,0,,,,,2
TK Jaya Karya,20111001,1,JL. KS. TUBUN I NO. 14,Kota Bambu Selatan,16203,,0,0,,,,,2
TK Jaya Karya,20110438,1,JL. SANGIHE DALAM BLOK E NO.24,Kelurahan Cideng,16008,,0,0,,,,,2
TK Jayakarta Montenssori,69789222,1,JL.KEMANG SELATAN I L.I,Bangka,16307,,0,0,,,,,2
TK Jayakarta Montessori,69830952,1,JL KEMANG SELATAN I L-1,Bangka,16307,12730,0,0,021-7194907,,sita_rio6@yahoo.com,http://jktmontessori.com,2
TK Jayakarta Montessori,20111526,1,JL. KEMANG SELATAN I L 1,Bangka,16307,,0,0,,,,,2
TK Jayakarya,69820312,1,Jl. Sangihe Dalam Blok B/24,Cideng,16008,10150,0,0,0817-803420,0,mahasiswa_roxy@yahoo.com,http://mm,2
TK Jemari,69830787,1,SIAGA BAPENAS 36,Pejaten Barat,16302,12510,0,0,0815-19451944,217994826,jemari@teachers.org,,2
TK Jembatan Batu,20111002,1,JL. JEMBATAN BAU 74,Pinangsia,16206,,0,0,,,,,2
TK Johar Baru,20110439,1,Jl. Johar Baru II No.10,Johar Baru,16004,10560,0,0,,,,,2
TK Josua School I,20110440,1,JL. RAWA SELATAN VII NO. 5,Kelurahan Kampung Rawa,16004,,0,0,,,,,2
TK Joy,20111003,1,JL. JEMB. HITAM NO. 29,Pekojan,16205,11240,0,0,021-6914307,,joy.school@ymail.com,,2
TK Jubilee,69795484,1,Jl. Sunter Jaya 1,Sunter Agung,16103,14350,0,0,021-65300300,2165300800,ecpjubilee@hotmail.com,http://jubilee-jkt.sch.id/,2
TK Jubilee,69856991,1,Jl. Sunter Jaya 1 no 1,Sunter Agung,16103,,-6.149878,106.858628,,,,,2
TK Jubilee,20110677,1,JL. SUNTER JAYA I BLOK A NO. 1,Sunter Agung,16103,,0,0,,,,,2
TK Junaida Wanita Islam,20110679,1,JL. SUNGAI TIRAM NELAYAN RT01 /09,Kali Baru,16106,,0,0,,,,,2
TK K 3 I,20110441,1,JL. SERDANG  RAYA NO. 30 RT. 2/4,Kelurahan Serdang,16006,,0,0,,,,,2
TK K 5 Bpk Penabur,20109613,1,JL. PADEPOKAN TAMAN MINI INDAH JAKTIM,Bambu Apus,16403,13890,0,0,021-84992920,2184992920,tkk5@bpkpenaburjakarta.or.id,http://tkk5.bpkpenaburjakarta.or.id,2
TK K Anugerah,20110442,1,JL. KARTINI RAYA NO. 10,Kelurahan Pasar Baru,16007,,0,0,,,,,2
TK K Bhayangkari 18,20111004,1,JL. KS. TUBUN III,Slipi,16203,,0,0,,,,,2
TK K Bhayangkari 7,20111005,1,JL. ASRAMA POLRI PALMERAH,Palmerah,16203,11480,-6.207701,106.790194,021-3521222,,RAHMATIDINI@GMAIL.COM,,2
TK K Halleluyah,20110443,1,JL. INDUSTRI VIII NO. 20A,Kelurahan Gunung Sahari U,16007,,0,0,,,,,2
TK K Harapan Mulia,20110680,1,Jl Pademangan Timur V Ujung Blok D Pademangan,Pademangan Timur,16102,14410,0,0,0821-22749846,216412761,sangerl@ymail.com,,2
TK K Harapan Zaman,20110681,1,JL. TELUK GONG RAYA NO. 6,Pejagalan,16101,,0,0,,,,,2
TK K Karunia,20110446,1,JL. GEREJA AYAM NO. 12,Kelurahan Pasar Baru,16007,,0,0,,,,,2
TK K Nazaret,20110682,1,JL. JEMBATAN DUA BLOK H/29,Pejagalan,16101,,0,0,,,,,2
TK K Ora Et Labora,20111527,1,JL. PANGLIMA POLIM I,Melawai,16306,12160,-6.24759,106.800488,021-7261145,7244265,tkkoelpangpol@gmail.com,http://oel.or.id,2
TK K Smart Wisdom School,20112479,1,PERUM.TAMAN SURYA II BLOK B1 NO.7-9,Pegadungan,16208,,0,0,,,,,2
TK K Smart Wisdon,20112478,1,PERUM.TAMAN SURYA II BLOK B1 NO.7-9,Pegadungan,16208,,0,0,,,,,1
TK K3I,20279831,1,JL. SERDANG RAYA NO. 30 RT. 02/04,Serdang,16006,,0,0,,,,,2
TK Kairos Gracia,20111006,1,CITRA GARDEN II BLOK H4 NO.6,Kalideres,16208,,0,0,021-5445113,215445105,kairosgracia@gmail.com,http://kairosgracia.sch.id,2
TK Kalam Kudus,20111007,1,JL. TANGKI LIO TIMUR NO. 48-49,Tangki,16206,11170,0,0,021-6281244,216120918,skkkj1@cbn.net.id,,2
TK Kalam Kudus II,20111008,1,JL. KOMP. GREEN GARDEN B IV/1,Kedoya Utara,16202,11520,0,0,021-5827066,5813850,sk3_jkt@yahoo.com,,2
TK Kalam Kudus III,20111009,1,JL. KOSAMBI BARU BLOK D4/I,Duri Kosambi,16207,11750,-6.169006,106.717021,021-5411640,5447858,tk.kalamkudus3@gmail.com,http://skkkjakarta.sch.id,2
TK Kalpataru,69830842,1,Jl. Pongtiku No. 1,Bintaro,16304,12330,0,0,021-7340944,7340944,,,2
TK Kalpataru,69785720,1,PONGTLIKU,Bintaro,16304,,0,0,,,,,2
TK Kalpataru,20111529,1,JL. PONTIKU BINTARO,Bintaro,16304,,0,0,,,,,2
TK Kanaan Global School,20111010,1,JL. BOULEVARD 12 TAMAN SURYA III,Pegadungan,16208,,0,0,021-6197205,54372047,,,2
TK Kancil,20111994,1,JL. CENTEX,Ciracas,16402,,0,0,,,,,2
TK Kancil I,20109878,1,JL. CENTEX  RT 08/02 CIRACAS JAKARTA TIMUR,,16402,13740,0,0,021-87706145,,tkkancil01@gmail.com,,2
TK Kancil II,20109879,1,JALAN CIBUBUR VICIRACAS,Cibubur,16402,13720,-6.356022,106.88059,021-8712018,,tkkancildua@gmail.com,,2
TK Kancil II,20111995,1,Jl. Cibubur VI,Cibubur,16402,,0,0,,,,,2
TK Karang Mekar,20111530,1,JL. KARANG POLA IV NO. 10,Jati Padang,16302,,0,0,,,,,2
TK Karang Mekar,69830780,1,KARANG POLA,Jati Padang,16302,,0,0,,,,,2
TK Kartiak X-15,69830896,1,CENDRAWASIH RAYA N0 18,Kebayoran Lama Selatan,16305,,0,0,,,,,2
TK Kartika,20111996,1,JL. ASRAMA GUPUSMU P. GEBANG,Pulo Gebang,16408,,0,0,,,,,2
TK Kartika IV-1,20109986,1,JL. CHANDRACA CIJANTUNG III,Baru,16401,,0,0,,,,,2
TK Kartika IX - 4,20111531,1,JL. KOMPLEK KOSTRAD,Petukangan Utara,16304,,0,0,,,,,2
TK Kartika IX-1,69789207,1,JL.DARMA PUTRA RAYA,Kebayoran Lama Selatan,16305,,0,0,,,,,2
TK Kartika IX-18,20109935,1,JL. SURATMO ASRAMA YONKAV.1 PASAR REBO JAKTIM,Kalisari,16401,13790,-6.3375,106.844,021-8716779,,tkkartika918@yahoo.com,,2
TK Kartika IX-4,69830843,1,Komplek Kostrad RT. 002/06,Petukangan Utara,16304,12260,-6.219572,106.745996,0821-11419250,,marlakanthirahayu70@gmail.com,,2
TK Kartika IX-4,69785731,1,PESANGGRAHAN,Petukangan Utara,16304,,0,0,,,,,2
TK Kartika IX-I,20111540,1,JL. DARMA PUTRA RAYA,Kebayoran Lama Selatan,16305,12240,0,0,021-72800535,,tkkartikakostrad91@gmail.com,,2
TK Kartika Kencana,20109753,1,JLN. RAYA BEKASI KM. 23/H. A. NO. 34 RT 001/02,,16408,13910,0,0,,,,,2
TK Kartika Kencana,20111997,1,Jl. Raya Bekasi Km. 23,Cakung Barat,16408,,0,0,,,,,2
TK Kartika Sari,69795402,1,Jl. Danau Indah 2A,Sunter Jaya,16103,14350,0,0,021-44347477,,,,2
TK Kartika Sari,20110683,1,JL. DANAU INDAH 2A,Sunter Jaya,16103,,0,0,,,,,2
TK Kartika VIII - 29,20111998,1,JL. KESATRIAAN X / RT. 011. 03,Kebon Manggis,16410,,0,0,,,,,2
TK Kartika VIII - 32,69857027,1,LAGOA KANAL KOMPLEK KOTERM,Kebon Bawang,16103,14320,0,0,021-94377145,,anikartika8@gmail.com,,2
TK Kartika VIII - 5,20112001,1,JL. KESATRIAN RAYA NO.2A,Kebon Manggis,16410,13150,0,0,021-8583385,,saptamarga1954@gmail.com,,2
TK Kartika VIII 28,69857139,1,ASR. YON AIR JL. DARMA RAYA,Semper Barat,16106,14130,0,0,0818-07330464,,,,2
TK Kartika VIII 36,20111734,1,JL. KOMPLEKS DITKESAD,Cililitan,16405,13640,0,0,,,,,2
TK Kartika VIII 38,69830990,1,PENGADENGAN SELATAN RAYA,Pengadegan,16308,12770,0,0,0882-11778085,,,,2
TK Kartika VIII-1,20109987,1,JL. ANYELIR CIJANTUNG II,Gedong,16401,13760,0,0,021-29841804,,,,2
TK Kartika VIII-13,69830724,1,Jl. Utama Mess PA. Zeni AD,Srengseng Sawah,16301,,0,0,0812-97507978,,,,2
TK Kartika VIII-13,69789132,1,MESS PA ZENI AD,Srengseng Sawah,16301,,0,0,,,,,2
TK Kartika VIII-14,69832176,1,Komp. Yonhub,Kelapa Dua,16202,,0,0,,,,,2
TK Kartika VIII-18,20109750,1,JL. RAYA BEKASI CAKUNG BARAT,,16408,13910,0,0,,,,,2
TK Kartika VIII-18,20112002,1,Jl. Raya Bekai Km. 23,Cakung Barat,16408,,0,0,,,,,2
TK Kartika VIII-2,20111730,1,JL. RANTAI MAS BULAK RANTAI,Kampung Tengah,16405,13540,0,0,,,,,2
TK Kartika VIII-22,20109826,1,ASRAMA GUPUSMU III PULO GEBANG,,16408,13950,0,0,,,,,2
TK Kartika VIII-27,69820273,1,Jl. Tanah Tinggi Barat No.5,Bungur,16003,,0,0,,,,,2
TK Kartika VIII-28,69795566,1,Jl. Darma Raya,Semper Barat,16106,,0,0,,,,,2
TK Kartika VIII-29,20109637,1,JL. KESATRIAN  X NO.20 MATRAMAN,,16410,13150,-6.2059,106.8499,0838-78073083,,,,2
TK Kartika VIII-3,69830718,1,Jl. Duku No. 99 Mabad I,Srengseng Sawah,16301,,0,0,,,,,2
TK Kartika VIII-32,69795488,1,Jl. Lagoa Kanal Komp. Koterm,Kebon Bawang,16103,,0,0,,,,,2
TK Kartika VIII-32,20110684,1,JL. LAGOA KANAL,Kebon Bawang,16103,,0,0,,,,,2
TK Kartika VIII-36,20110087,1,KOMPLEK DITKESAD CILILITAN,Cililitan,16405,,0,0,,,,,2
TK Kartika VIII38,69785804,1,PENGADEGAN SELATAN RAYA,Pengadegan,16308,,0,0,,,,,2
TK Kartika VIII-40,20109602,1,JL. RAYA CEGER NO.20 KOMP. PUSPOM AD,Ceger,16403,13820,-6.313526,106.892134,0813-17973199,,tkkartikavIII40@gmail.com,,2
TK Kartika VIII-5,20109635,1,JL.KESATRIAN RAYA NO. 2A BERLAND,,16410,,0,0,,,,,2
TK Kartika VIII-7,20112003,1,JL. KESATRIAAN II NO. 1,Kebon Manggis,16410,,0,0,,,,,2
TK Kartika VIII-7,20109636,1,Jl. Kesatrian Raya II no.1 Matraman,,16410,,0,0,,,,,2
TK Kartika VIII-8,20112014,1,JL. RAYA BOGOR KM. 27 KOMPLEK ZENI  AD,Pekayon,16401,13710,0,0,,,ica.azalia@gmail.com,,2
TK Kartika VIII-9,69830747,1,Jl. Raya Lenteng Agung No. 16 RT. 002/010,Lenteng Agung,16301,12610,0,0,021-78889949,,,,2
TK Kartika VIII-9,69785596,1,RAYA LENTENG AGUNG,Lenteng Agung,16301,,0,0,,,,,2
TK Kartika X - 1,20110216,1,JALAN JEND. URIP SUMOHARJO NO. 12 JATINEGARA,Jatinegara,16406,,0,0,,,,,2
TK Kartika X 12,20111731,1,JL. KOMPLEKS PUSDIKES,Kramat Jati,16405,,0,0,,,,,2
TK Kartika X 18,20111732,1,JL. KODAM JAYA CILILITAN II,Kramat Jati,16405,,0,0,,,,,2
TK Kartika X 2,20111532,1,JL. KODAM BINTARO,Pesanggrahan,16304,,0,0,,,,,2
TK Kartika X-1,20112004,1,JL. JENDRAL URIP NO. 12,Bali Mester,16406,,0,0,,,,,2
TK Kartika X-11,69830846,1,JL. PRAJURIT NO.1,Pesanggrahan,16304,,-6.25913,106.755734,021-7095230,,tkkartikax-11@yahoo.co.id,,2
TK Kartika X-12,20109988,1,ASRAMA YONKAV 7 CIJANTUNG III,Baru,16401,,0,0,021-8701442,,tkkartikax12.yonkav7@gmail.com,,2
TK Kartika X-12,20112005,1,JL. YON KAV 7,Baru,16401,,0,0,,,,,2
TK Kartika X-12,20110088,1,KOMPLEK PUSDIKKES TNI-AD KRAMAT JATI,Kramat Jati,16405,,0,0,,,,,2
TK Kartika X-13,20110170,1,JL. TEMU LAWAK IV K.P.A.D CIBUBUR,Cibubur,16402,13720,0,0,021-87756862,,,,2
TK Kartika X-14,20111011,1,JL. DAAN MOGOT KOMP. KODAM JAYA,Kalideres,16208,11840,0,0,,,,,2
TK Kartika X-15,69830876,1,Jl. Cendrawasih Komplek Tanah Kusir,Pondok Pinang,16305,12240,0,0,021-7294913,,megawati.hala84@gmail.com,,2
TK Kartika X-15,69786005,1,CENDRAWASIH RAYA NO.18,Kebayoran Lama Selatan,16305,,0,0,,,,,2
TK Kartika X-15,20111533,1,JL. KOMP. KODAM TANAH KUSIR,Kebayoran Lama Selatan,16305,,0,0,,,,,2
TK Kartika X-16,20111534,1,JL. PONDOK JAYA VIII/I,Pela Mampang,16307,,0,0,,,,,2
TK Kartika X-16,69789238,1,PONDOK JAYA VIII/I,Pela Mampang,16307,,0,0,,,,,2
TK Kartika X-16,69830953,1,PONDOK JAYA VIII,Pela Mampang,16307,,0,0,,,,,2
TK Kartika X-17,20110309,1,JL. BAZOKA KOMPLEK KODAM JAYA RT 009/06 JATIWARINGIN CIPINANG MELAYU,Makasar,16404,13620,-6.2513,106.9144,021-86608625,,tkkartikax17@gmail.com,,2
TK Kartika X-17,20112006,1,Jl. Komp. Kodam Jatiwaringin,Cipinang Melayu,16404,,0,0,,,,,2
TK Kartika X-18,20110089,1,KOMPLEK KODAM JAYA CILILITAN II,Tengah,16405,,0,0,,,,,2
TK Kartika X-19,20109961,1,JL. PENDIDIKAN II ASRAMA DENZIPUR 3,Cijantung,16401,13770,-6.317,106.8606,021-8400595,,,,2
TK Kartika X-2,69830845,1,RAYA BINTARO PERMAI NO. 53,Pesanggrahan,16304,12320,0,0,021-73692703,2173692703,yulindawatireny@yahoo.com,,2
TK Kartika X-2,69785725,1,BINTARO PERMAI NO.53,Pesanggrahan,16304,,0,0,,,,,2
TK Kartika X-3,20112007,1,Jl. Temu Ireng KPAD,Cibubur,16402,,0,0,,,,,2
TK Kartika X-3,20110140,1,JLN. TEMU IRENG RT 001/07 KPAD CIBUBUR,Cibubur,16402,13720,0,0,,,,,2
TK Kartika X-4,20112008,1,JL. KESATRIAAN IX RT. 017/03,Kebon Manggis,16410,13150,0,0,,,,,2
TK Kartika X-4,20109634,1,Jl. Kesatrian IX No. 2 RT 017/03,,16410,,0,0,,,,,2
TK Kartika X-5,20109989,1,JL. RAYA CONDET NO. 55,Gedong,16401,13760,-6.2977,106.8545,021-71359748,,tkkartikax5.rindam@gmail.com,,2
TK Kartika X-6,20109974,1,JL JAYASAKTI II ASR. BRIGIF 1/PIK JAYA SAKTI,Kalisari,16401,13790,-6.3379,106.8612,,,tkkartikax6brigif1pikjs@gmail.com,,2
TK Kartika X-6,20112009,1,JL. KOMP BRIGIF 1 PEKAYON,Kalisari,16401,,0,0,,,,,2
TK Kartika X-7,20112010,1,JL. ASRAMA YONIF MEKANIS 201/JY,Pekayon,16401,13710,-6.3525,106.8652,021-85330090,,kartikax7pekayon@gmail.com,,2
TK Kartika Xi 31,20111733,1,JL. RAYA BOGOR NO.2,Kramat Jati,16405,,0,0,,,,,2
TK Kartika Xi-1,20112011,1,JL. ANYELIR C. II,Gedong,16401,,0,0,,,,,2
TK Kartika Xi-13,20111536,1,JL. UTAMA MESS PA ZENI AD,Srengseng Sawah,16301,12640,0,0,0812-97507978,,,,2
TK Kartika Xi-14,20111013,1,KOMP. YON HUB KELAPA DUA,Kelapa Dua,16202,,0,0,,,,,2
TK Kartika Xi-27,20110447,1,JL. TANAH TINGGI BARAT NO. 5,Kelurahan Bungur,16003,,0,0,,,,,2
TK Kartika Xi-2VIII-2,20110090,1,PER. AD JL. RANTAI EMAS IV BULAK RANTAI,Tengah,16405,,0,0,,,,,2
TK Kartika Xi-3,20111537,1,Jl. Duku No. 99 Komplek Mabad I,Srengseng Sawah,16301,,0,0,,,,,2
TK Kartika Xi-38,20111538,1,JL. PENGADENGAN SELATAN RAYA,Pengadegan,16308,,0,0,,,,,2
TK Kartika Xi-40,20112013,1,JL. RAYA CEGER NO. 20 PUSPOM,Ceger,16403,,0,0,,,,,2
TK Kartika Xi-9,20111539,1,JL. RAYA DEPOK,Lenteng Agung,16301,,0,0,,,,,2
TK Kartika X-II,20111535,1,JL. PRAJURIT PESANGGRAHAN,Pesanggrahan,16304,,0,0,,,,,2
TK Kartika XII-18,20112015,1,JL. SURATMA ASRAMA YONKAV 1,Kalisari,16401,,0,0,,,,,2
TK Kartika XIII-6,20112016,1,JL. TEMU LAWAK IV KPAD,Cibubur,16402,,0,0,,,,,2
TK Kartika Xv-1,20109956,1,"JL CANDRACA 1, CIJANTUNG III",Baru,16401,13780,-6.3223,106.8471,,,tkkartikaxv1.kopassus@gmail.com,,2
TK Kartika Xv-6,20110010,1,JL. SATYA 4 NO. 1 KOMPLEK KOPASSUS,Baru,16401,13780,-6.323576,106.844645,021-8414149,,kartikalimabelasenam@gmail.com,,2
TK Kartika Xvi-1,20112017,1,JL. CANDRACA CIJANTUNG III,Baru,16401,,0,0,,,,,2
TK Kartika Xvi-6,20112018,1,JL. SATYA A KOPASSUS,Baru,16401,,0,0,,,,,2
TK Kartini,20111014,1,JL. MESJID AL ANWAR NO. 13,Sukabumi Utara,16202,11540,-6.210873,106.782581,021-5332968,,tkkartini1979@gmail.com,,2
TK Kartini,69790683,1,"Sayur Asam, No. 14 Rt. 009/06",Joglo,16201,11640,0,0,021-5859439,,,,2
TK Kartini,20110449,1,JL. KARTINI DALAM VII NO. 18,Kartini,16007,,0,0,0813-15674276,,,,2
TK Kartini,69866579,1,Jl. Sayur Asem Rt. 009/06 No. 14,Joglo,16201,,0,0,,,,,2
TK Kartini,69931948,1,Jalan H. Nawi No. 19,Bintaro,16304,,0,0,,,,,2
TK Kartini,20110141,1,JL. MUALIM AMINUDIN RT 06/014 NO. 7 CIBUBUR,Cibubur,16402,13720,0,0,,,,,2
TK Kartini,20110448,1,JL. KALI BARU TIMUR V/1,Kelurahan Utan Panjang,16006,,0,0,,,,,2
TK Kartini,20112020,1,JL. SULAIMAN NO 41,Cipinang Melayu,16404,,0,0,,,,,2
TK Kartini,20112019,1,Jl. Kesadaran No. 17,Cipinang Muara,16406,,0,0,,,,,2
TK Kartini,20110046,1,JL. KESADARAN IV NO. 17 RT 10/01 CIPINANG MUARA,Cipinang Muara,16406,,0,0,,,,,2
TK Kartini,69820382,1,Jl. Kalibaru Timur V No.1,Utan Panjang,16006,,0,0,,,,,2
TK Kartini II,69785935,1,JL.H.NAWI NO.19,Bintaro,16304,,0,0,,,,,2
TK Kartini Majasari,20110190,1,JL. CIPINANG PULO MAJA RT 03/010 NO. 24,Cipinang Besar Utara,16406,13410,-6.218567,106.880649,021-29360420,,suprihatin32@yahoo.com,,2
TK Kartini Mayasari,20112021,1,JL. CIPINANG PULO MAJA NO. 30,Cipinang Besar Utara,16406,,0,0,,,,,2
TK Kartini Otista,20110217,1,JL. OTO ISKANDAR DINATA NO. 64 A,Jatinegara,16406,13330,0,0,021-8192882,,nursyah02@gmail.com,,2
TK Kartini Otista,20112022,1,Jl. Otista Gg. Sensus I/3,Bidara Cina,16406,,0,0,,,,,2
TK Karunia,20112023,1,JL. DURI BULAN,Batu Ampar,16405,13520,0,0,021-80880868,,,,2
TK Karunia,69908067,1,Jl. Pedongkelan Belakang RT.002/004 No.40,Cengkareng Timur,16207,11730,-6.142134,106.740804,0813-16933094,,,,2
TK Karunia,20110091,1,JALAN DURI BULAN RT. 01/14 NO. 74 D BATU AMPAR,Batu Ampar,16405,,0,0,,,,,2
TK Karunia Illahi,20109880,1,JL. RAYA CENTEX NO.71  CIRACAS,,16402,,0,0,,,,,2
TK Karya Kasih,69856985,1,SUNTER PARADISE 16 BLOK L/7,Sunter Agung,16103,,0,0,,,,,2
TK Karya Kasih,20110685,1,JL. ST. PARADIS BLOK L NO. 7,Sunter Agung,16103,,0,0,,,,,2
TK Karya Kasih,69795469,1,Jl. Paradise 16 Blok L/7,Sungai Bambu,16103,,0,0,,,,,2
TK Karya Penebus,20110686,1,JL. PADEMANGAN VIRT.5/10,Pademangan Timur,16102,,0,0,,,,,2
