nama,npsn,bentuk_pendidikan,alamat_jalan,desa_kelurahan,kode_wilayah,kode_pos,latitude,longitude,nomor_telepon,nomor_fax,email,website,status_sek
TKs Islam Al-Khoiriyah,69728388,1,JL PONDOK RANDU RT 004 RW 02,Duri Kosambi,16207,11750,-6.174701,106.724989,0812-12738836,,,,2
TKs Islam An-Nur,20178291,1,JL PULO INDAH NO 2 PETUKANGAN,Petukangan Utara,16304,,0,0,,,,,2
TKs Islam As-Syifa,69752417,1,MARUNDA PULO RT 002 RW 07 NO 59,Marunda,16106,,0,0,,,,,2
TKs Islam Baitussalam,20110612,1,JL. SUNGAI BAMBU NO. 10,Sungai Bambu,16103,,0,0,,,,,2
TKs Islam Daar El Muhajirin,69754225,1,NUSA INDAH V NO 19,Malaka Jaya,16407,13460,0,0,,,,,2
TKs Islam Darussalam,20111448,1,JL CIPUTAT RAYA GG H ROMLAH RT 005/02,Pondok Pinang,16305,,0,0,,,,,2
TKs Islam Mutiara Insani,20111513,1,JL. H. MUHI RAYA NO. 27,Pondok Pinang,16305,,0,0,,,,,2
TKs Islama Ar Rahmah,69753669,1,JL.PULO CEMPAKA RAYA NO.54 A RT.008 /014,Grogol Utara,16305,,0,0,,,,,2
TKs It Karunia,69785965,1,JL. PINANG IV NO 107 RT 006/02,Pondok Labu,16303,,0,0,,,,,2
TKs Kemala Bhayangkari 21,69754736,1,"KOMPLEK POLANTAS, JL TB SIMATUPANG",Gedong,16401,13760,0,0,0812-87284870,,Kemalabhayangkari21@gmai.com,,2
TKs Madina Islamic School,69831006,1,JL. TEBET DALAM 4 NO. 1,Tebet Barat,16309,12810,0,0,021-8312311,8309373,info@madinaschool.sch.id,http://madinaschool.sch.id,2
TKs Madina Islamic School,69726876,1,JL TEBET DALAM 4 NO 1,Teber Barat,16309,,0,0,,,,,2
TKs Mahabodhi Vidya,69753822,1,"PERUM CITRA 3, JL PALEM ANGGUR KAV 8",Pegadungan,16208,,-6.129557,106.706938,,,,,2
TKs Mini Bakti,20112068,1,JL. KAYU JATI III,Rawamangun,16409,,0,0,,,,,2
TKs Mitra Penabur,69726026,1,BOULEVARD BARAT B 53- 54 KELAPA GADING SQUARE,Kelapa Gading,16105,,0,0,,,,,2
TKs Nommensen,69728747,1,JL RAYA KIWI NO 65 RT 001/012,Cibubur,16402,13720,-6.337777,106.869721,,,,,2
TKs Nurul Fajri,20111598,1,JL. TANAH ARA No.49 PONDOK PINANG,Pondok Pinang,16305,,0,0,,,,,2
TKs Pelangi Kasih,20110744,1,"TAMAN GRISENDA BLOK A1 NO 28, JL PANTAI INDAH TIMUR",Kapuk Muara,16101,,0,0,,,,,2
TKs Putra Amanah,20110339,1,JL. RAYA NUSA INDAH BLOK 40 NO.10,Malaka Jaya,16407,13460,0,0,021-86613989,,kbtk_putraamanah@yahoo.com,,2
TKs Rusnibra,20110518,1,JL. KAMPUNG IRIAN GG. I/15,Serdang,16006,,0,0,,,,,2
TKs Santa Agatha,69755798,1,RUKO PERMATA TAMAN PALEM BLOK B-1 NO 3,Pegadungan,16208,11830,0,0,021-54353206,,jannieeffendi@yahoo.com,,2
TKs Tiara School,69754774,1,JL. SWAKARSA IV NO. 147-148 PONDOK KELAPA,Pondok Kelapa,16407,13450,0,0,021-86905186,218651199,tiaraschoolpondokkelapa1@gmail.com,,2
TKs Tunas Muda X Ikkt,20111292,1,KOMP. HANKAM MABES TNI,Sukabumi Utara,16202,11540,0,0,021-53678229,,,,2
TK-Sd Satu Atap Harapan Mulia 01,69820326,1,Jl.Cempaka Wangi III No.1,Harapan Mulya,16006,10640,0,0,021-4228074,0,sdnharapanmulia01pagi@yahoo.com,,2
TK-Sd Satu Atap Kebon Kosong 17,69820409,1,Jl. Ketapang Baru III,Kebon Kosong,16006,10630,0,0,021-4223252,,tksatuatapkebonkosong17pagi@gmail.com,,2
TK-Sd Satu Atap Sdn Rbu 05 Pagi,69857065,1,JL. RAWABINANGUN V. NO.36 A,Rawabadak Utara,16104,,0,0,,,,,1
TKywka I,69789254,1,MANGGARAI UTARA II/C8,Manggarai,16309,,0,0,,,,,2
Trinity National Plus School,69857072,1,RUKO BUKIT GADING MEDITERANIA BLOK AA 1-2 KELAPA GADING - 14240,Kelapa Gading Barat,16105,14240,0,0,021-4529571,214533688,,,2
Tunas Insani,20109966,1,JL. RAYA BOGOR KM 28,Pekayon,16401,,0,0,,,,,2
Tunas Mekar,20110262,1,Jl Lingkar Duren Sawit Rt 01/012,Duren Sawit,16407,,0,0,,,,,2
Tunas Merah Putih,69820784,1,Jl. Tanjung Lengkong Rt.015/07 No.2,Bidara Cina,16406,,0,0,,,,,2
Tunas Muda,90101120,1,"JL. Angsana Raya D 8/2 Taman Kedoya Baru, Kebon Jeruk, Jakarta Barat",,16202,11520,0,0,021-5818766,5818767,cservice@sekolahtunasmuda.com,http://sekolahtunasmuda.com,2
Tunas Muda School,90101077,1,"Jl. Meruya Utara No 71 Kembangan, Jakarta Barat",,16201,11620,0,0,021-5870329,215864307,cservice@sekolahtunasmuda.com,,2
Umdatur Rasikhien,20109098,1,Cakung,Cakung,16408,,0,0,,,,,2
Ummatan Wasathan,69857156,1,KALI BARU BARAT VII,Kali Baru,16106,14110,0,0,0813-11227774,,tkummatanwasathon123@gmail.com,,2
Wijaya Kusuma,69789128,1,JALAN RAYA DEPOK NO.16 LENTENG AGUNG,Lenteng Agung,16301,,0,0,,,,,2
Yayasan Sekolah Izara,69823274,1,KEBAGUSAN DALAM I NO.90,Kebagusan,16302,,0,0,,,,,2
YPU Tiara Bunda,20111715,1,Jl. Tebet Barat Dlm VIII No. 51,Tebet Barat,16309,,0,0,,,,,2
Al - Haq,69795595,2,Jl. Swasembada Timur XIX No.37/40 Rt.013/05,Kebon Bawang,16103,,0,0,,,,,2
Al - MatIIn,69864593,2,Jln RAYA SEMANA KP.PULO RT 004 /08 GANG H. ANIM NO . 56,Semanan,16208,11850,-6.168481,106.707287,,,paud.almatIIn@gmail.com,,2
Al Barkah Al Husein,69822332,2,JL. SAWO I NO 35,Cipete Utara,16306,12150,-6.261661,106.797766,0812-86575879,,paudalbarkah_alhusein@yahoo.com,,2
Al Jihad,69795544,2,Jl. Papanggo I Rt.005/002,Papango,16103,,0,0,,,,,2
Al-Husna,69832232,2,Jl. Cempaka Raya No.61,Rawa Buaya,16207,,0,0,,,,,2
Al-Ma Arif,69832241,2,Jl. Sumur Boor RT04/RW012,Kalideres,16208,,0,0,,,,,2
Amanah,69821100,2,Jl. Delima III Blok 09,Malaka Sari,16407,,0,0,,,,,2
An Nadzifah,69856735,2,Kp Gaga Rt 02 Rw 09 N0 127,Semanan,16208,11850,-6.172169,106.697856,0877-88422207,,7darulnidzom@gmail.com,,2
Anafari Nur,69821022,2,Jl. Pertanian Selatan Rw.01 Kelurahan Klender,Klender,16407,,0,0,,,,,2
Anggrek Kasih,69820786,2,H. JIMMY NO 49 RT 011 RW 02,Kalisari,16401,13790,0,0,021-8717387,,paud.anggrekkasih@gmail.com,,2
An-Nisa,69795731,2,Jl. Warakas I Gg. 25 Rt.07/08,Papango,16103,,0,0,,,,,2
Anyelir,69820864,2,Jl. Raya Inpres Gang Saad Rt.004/02,Kampung Tengah,16405,13540,0,0,0813-14229923,,paudanyelirtengah@gmail.com,,2
Arrahmah,69820822,2,JL. SKWADRON KP. BARU I NO.57 RT.001 RW.05,Halim Perdana Kusumah,16404,,0,0,021-80888654,,,,2
Bai Aturridwan,69810971,2,Jl. Prepedan,Kamal,16208,,0,0,,,,,2
Berlian,69820945,2,Jl. Angkasa No.21 Rt.009/02,Ceger,16403,,0,0,,,,,2
Bhakti Ibu,69821101,2,JL. RAYA BOGOR KM 24 RT 004/01,Ciracas,16402,13740,0,0,0813-10652432,,sumarnisadeli@rocketmail.com,,2
Bina Melati,69820863,2,Kampung Pulo No.12 RT.011 Rw.002,Kampung Melayu,16406,,0,0,,,,,2
Bina Remaja,69831933,2,PPA No.1,Bambu Apus,16403,,0,0,,,,,2
Bintang Bintang,69785901,2,AGUNG RAYA II RT 05 RW 07 NO.28,Lenteng Agung,16301,,0,0,,,,,2
Birrul Walidain,69821105,2,Jl. Damai I Rt 002/06,Cilangkap,16403,,0,0,,,,,2
BKB Baitul Mushawirin,69795645,2,Jl. Warakas II No. 4 Rt. 003/02,Warakas,16103,,0,0,,,,,2
BKB Kasih Ibu,69783559,2,JL. SENAYAN NO 30,Rawa Barat,16306,,0,0,,,,,2
BKB PAUD Aisyiyah,69831074,2,Anggrek 3,Karet Kuningan,16310,12490,-6.216676,106.825655,,,,,2
BKB PAUD Al Fikri,69831063,2,Jl. Bintaro Permai III No. 48 RT. 006/09,Bintaro,16304,12330,-6.228,106.7492,0813-87298287,,paudalfikri68@gmail.com,,2
BKB PAUD Al-Ghifari,69822354,2,Seha,Grogol Selatan,16305,12220,-6.2275,106.7818,0857-82499416,,alghifarihalimnariyah@gmail.com,,2
BKB PAUD Amanah,69831065,2,Jl. H. Misan No. 46 RT. 09/05,Petukangan Utara,16304,,0,0,,,,,2
BKB PAUD Anggrek,69783552,2,JL. PAHLAWAN NO.7 RT007/07,Duren Tiga,16308,,0,0,,,,,2
BKB PAUD Annisa,69820909,2,SWAKARSA I B RT. 006 RW. 03,Pondok Kelapa,16407,,0,0,,,,,2
BKB PAUD Assyukuria,69831057,2,JL. Gintung Gg. Rambutan,Tanjung Barat,16301,12530,0,0,0812-81294332,,,,2
BKB PAUD Bina Ceria,69939067,2,Jl Binawarga no.17 Rt.003/Rw.07,Kalibata,16308,12750,0,0,0857-11298885,,evamuriyana@gmail.com,,2
BKB PAUD Bina Melati,69820956,2,JATINEGARA BARAT,Cipinang Muara,16406,,0,0,,,,,1
BKB PAUD Bina Pertiwi,69831067,2,JL. RADIO DALAM DEPERDAG I,Gandaria Utara,16306,,0,0,,,,,2
BKB PAUD Bintang Bintang,69831055,2,Jl. Agung Raya II No. 28 RT. 005/007,Lenteng Agung,16301,12610,-6.331635,106.837599,021-7868357,,wulansundari53@gmail.com,,2
BKB PAUD Bougenville,69821155,2,JL. UTAN KAYU SELATAN RT 3/ RW 10,Utan Kayu Selatan,16410,13120,0,0,0815-13747681,,bougenvilleuks@gmail.com,,2
BKB PAUD Buah Hati Ibu Rw.05,69820923,2,Jl. Nusa Indah III RT.003 RW.05,Malaka Jaya,16407,13460,0,0,0812-86065888,,paudbuahatibu@gmail.com,,2
BKB PAUD Cahaya Hati,69831062,2,H ABU NO 28 RT 006 RW 07,Cipete Selatan,16303,,0,0,,,,,2
BKB PAUD Camar Rw.05,69821129,2,Jl. Prumpung Tengah RT.010 RW.05,Cipinang Besar Utara,16406,13410,-6.220639,106.880981,0813-18011188,218190527,srisyafrie88@gmail.con,,2
BKB PAUD Dahlia,69947286,2,JL. JATINEGARA TIMUR IV KOMP. PENDIDIKAN RAWABUNGAN RT.002/007,Rawa Bunga,16406,13350,0,0,0882-13363207,,,,2
BKB PAUD Dorang I Rw 002,69857201,2,Jl. Tabah Raya,Kelapa Gading Barat,16105,,0,0,,,,,2
BKB PAUD Harapan Bangsa,69831064,2,Duku,Petukangan Utara,16304,,0,0,,,,,2
BKB PAUD Harapan Bunda,69821044,2,KOMODOR HALIM RT.007 RW.08,Halim Perdana Kusumah,16404,,0,0,,,,,2
BKB PAUD Harapan Mulia,69878034,2,M. Saidi No. 35c,Petukangan Selatan,16304,,0,0,,,p.harapanmulia@yahoo.co.id,,2
BKB PAUD Harmoni,69929637,2,Jl. AMD V RT. 06/010,Petukangan Utara,16304,12260,0,0,,,paudharmoni.petukanganutara@gmail.com,,2
BKB PAUD Karya Ibu,69947986,2,JL. RAYA BEKASI KM. 17 RT.005/003,Jatinegara,16408,,0,0,021-4614428,,,,2
BKB PAUD Kemuning,69777626,2,JL. WIKA I A RT 008/06,Srengseng Sawah,16301,,0,0,,,,,2
BKB PAUD Kenanga,69821043,2,CIPINANG BALI II RT.05 RW.13,Cipinang Muara,16406,53241,0,0,0813-31908769,,artosunarto16@yahoo.co.id,,2
BKB PAUD Melati,69947377,2,JI. Bekasi Timur II No.1 Rt.015 Rw.004,Rawa Bunga,16406,13350,0,0,0852-23995584,,bkbpaudmelatirb@gmail.com,,2
BKB PAUD Melati Rw 04,69821127,2,Jl. Lapangan Bola Rt.006/04,Pondok Ranggon,16403,,0,0,,,,,2
BKB PAUD Pandan,69778047,2,JL. PANDAN RAYA NO.6,Kramat Pela,16306,,0,0,,,,,2
BKB PAUD Putra Bangsa,69778046,2,JL. DAMAI III RT 008/04,Cipete Utara,16306,,0,0,,,,,2
BKB PAUD Seruni,69778059,2,JL. AL- IKHLAS NO. 19 RT 014/05,Manggarai Selatan,16309,,0,0,,,,,2
BKB PAUD Taman Pulo Indah,69820807,2,"JL. KURMA RAYA, BLOK Q-2 TAMAN PULO INDAH RT 004/018",Penggilingan,16408,,0,0,,,,,2
BKB PAUD Tunas Harapan,69947858,2,JL. KEMUNING RT.007/001,Rawa Bunga,16406,13350,0,0,0838-79639394,,bkbpaudtunasharapan01@gmail.com,,2
BKB PAUD Tunas Melati,69821011,2,JL.TAMAN MALAKA UTARA BLOK C RT.04 RW.011,Malaka Jaya,16407,13460,0,0,0812-87978197,,nurbaitikarel@gmail.com,,2
BKB PAUD Wijaya Kusuma,69903861,2,Jl. Penyelesaian Tomang I RT.002/01 No.35,Meruya Utara,16201,,-6.197562,106.73506,0898-9054304,,paudwijayakusuma13@gmail.com,,2
Budi Harapan,69795526,2,Jl. Warakas V Gg. 2 No. 102 - 104,Warakas,16103,,0,0,,,,,2
Bunda Mulia School,90101123,2,"JL. Lodan Raya No. 2 Ancol, Jakarta Utara",,16102,14430,0,0,021-6909742,6919405,kb@bundamulia.sch.id,http://bms.sch.id,2
Ceria,69821111,2,Jl. Pondok Baru Rt.08 Rw.011,Cijantung,16401,13770,0,0,0812-33782856,,paud_ceria@yahoo.com,,2
Cikal Harapan Hati,69795657,2,Jl. Griya Agung Blok N3 No. 54-55,Sunter Agung,16103,,0,0,,,,,2
Dahlia 07,69832243,2,Jl. Marinda,Tegal Alur,16208,,0,0,,,,,2
Dahlia Ceria,69820837,2,Jl. Tepi Buaran III Rt.005/15,Duren Sawit,16407,,0,0,,,,,2
Darul Falah Volker,69795568,2,Jl. RE Martadinata Kp. Muara Bahari Gg. Bak Air RT.010/013,Tanjung Priuk,16103,,0,0,,,,,2
Edukidz Asia,69878042,2,JL. KRAMAT 1 RT 01 RW 02,Grogol Selatan,16305,,0,0,,,,,2
Eton House Indonesia,69852748,2,JL. KEBAYORAN LAMA NO. 121,Grogol Utara,16305,,0,0,,,,,2
Fajrul Islam,69820886,2,KP. JATINN0.23 RT.007 RW.001,Jatinegara Kaum,16409,,0,0,,,,,2
Glory School,69880112,2,JL.SUNTER GARDEN BLOK B3 NO.10.B RT.005/018 KEL SUNTER AGUNG KEC.TANJUNG PRIOK J,Sunter Agung,16103,14350,-6.136464,106.864775,021-65301552,65301552,irenepanjaitan12@gmail.com,,2
Highscope Indonesia Jakarta - Cilandak,90101136,2,"JL. TB Simatupang No. 8 Cilandak, Jakarta Selatan",,16303,,0,0,,,,,2
Hope For Generation,69795562,2,Jl. Pantai Indah Timur Puri Grisenda Blok F2/5 PIK,Kapuk Muara,16101,,0,0,,,,,2
Ipeka Intergrated Christian School,90101131,2,JL. Batu Mulia Taman Meruya Ilir Blok K,Meruya Utara,16201,,0,0,,,,,2
Jakarta Intercultural School,90101104,2,"Jl. Pattimura I no 2, Kebayoran Baru Jakarta Selatan",,16306,12110,0,0,021-7692555,7222301,,,2
Jakarta Intercultural School,90101102,2,"Jl. Duta Indah III, Pondok Indah, Jakarta Selatan",,16305,,-6.28609,106.782353,021-7692555,7507618,,http://jisedu.or.id,2
Kaledupa,69795673,2,Jl. Warakas III Gg. 6 No.34 Rt.011 Rw.04,Warakas,16103,,0,0,,,,,2
KB - PAUD Kid S Club,69857180,2,KAMP. MUARA BAHARI NO. 189 RT 010 RW 013,Tanjung Priuk,16103,14310,-6.1165,106.871728,021-43910478,,oi.rakhman@yahoo.com,,2
KB Abc,69795637,2,Ancol barat I no.8A Rt 005/01,Ancol,16102,,0,0,,,,,2
KB Adzkia Rahmah,69857224,2,Jl. Tipar Timur Rt.011 Rw.04 No.10,Semper Barat,16106,,0,0,,,,,2
KB Adzkia Rahmah,69795710,2,Jl. Tipar Timur Rt. 11/04 No. 10,Semper Barat,16106,,0,0,,,,,2
KB Aisyiyah 61,69831058,2,KEMUNING DALAM I/73,Pejaten Timur,16302,,0,0,,,,,2
KB Aisyiyah 62,69831059,2,PAGUJATEN RAYA RT003 RW007,Pejaten Timur,16302,,0,0,,,,,2
KB Aisyiyah Roxi,69773333,2,BAKTI RAYA NO.117 RT.01 RW.07,Cideng,16008,,0,0,,,,,2
KB Aiueo,69871235,2,JL. ANGGREK ROSLIANA VII NO. 211,Kemanggisan,16203,,0,0,,,,,2
KB Al Haq,69857177,2,JL.Swasembada Timur XIX N0:37 Rt.013/05,Kebon Bawang,16103,14320,-6.117876,106.891329,,,lhaq@yahoo.co.id,,2
KB Al Husna,69795533,2,Jl. Tipar Cakung Rt.005 Rw.001,Suka Pura,16106,,0,0,,,,,2
KB Al Husna,69857209,2,TIPAR CAKUNG RT 005/01 NO.127,Suka Pura,16106,14140,-6.167777,106.934481,,,,,2
KB Al Istiqomah,69857208,2,Jl. Tipar Cakung Rt.001 Rw.01,Suka Pura,16106,14140,0,0,0818-07925720,,paudistiqomah2008@yahoo.com,,2
KB Al Istiqomah,69795629,2,Tipar Cakung Rt. 001/01 No. 4,Suka Pura,16106,,0,0,,,,,2
KB Al Jihad,69857165,2,JL. PAPANGGO I D RT.005/02,Papango,16103,,0,0,,,,,2
KB Al Ma Arif,69856737,2,sumur boor,Kalideres,16208,,0,0,,,,,2
KB Al Ma Arif,69865836,2,JL. SUMUR BOOR RT 04/12 NO.04,Kalideres,16208,,0,0,,,,,2
KB Al-Anwariyah Idris,69795653,2,Malaka I Rt. 09/05,Rorotan,16106,,0,0,,,,,2
KB Alfalah,69795548,2,Jl. Tipar Cakung Rt. 006/05 No. 110,Suka Pura,16106,,0,0,,,,,2
KB Al-Fath,69783472,2,KP. SETU / KELINCI NO.34,Ciganjur,16301,,0,0,,,,,2
KB Al-Husna,69795664,2,Jl. Tipar Cakung Rt. 005/01 o. 27,Suka Pura,16106,,0,0,,,,,2
KB Al-Ikhlas,69831052,2,Jl. Desa Putera Gg. Semangka RT. 006/005,Srengseng Sawah,16301,12640,0,0,0896-02790611,,,,2
KB Amanah,69795503,2,Rorotan IX Gg. 9 Rt. 008/07 No. 48,Rorotan,16106,,0,0,,,,,2
KB Amanah,69857159,2,Jl. Budi Mulya,Pademangan Barat,16102,,0,0,,,,,2
KB Anak Bangsa,69831071,2,MESJID II NO.18 RT 009 RW 02,Kebon Baru,16309,12830,0,0,021-8304965,218379151,paudanakbangsa@yahoo.co.id,,2
KB Anak Bangsa,69785650,2,MESJID II NO.18,Kebon Baru,16309,,0,0,,,,,2
KB An-Nisa,69857196,2,Jl B Gg.2c2 No.30 Rt. 013 Rw. 001,Lagoa,16104,14270,-6.111579,106.913621,021-43938435,,kbpaudannisabaru@gmail.com,,2
KB An-Nisa,69795630,2,Jl. B Gg. II C2 No. 30 Rt. 013/01,Lagoa,16104,,0,0,,,,,2
KB Arridho Bestari,69832239,2,Pasar Alam Gg. Masjid RT01/11,Kapuk,16207,,-6.132074,106.745278,,,,,2
KB Ar-Ridwaniyah,69795693,2,Tipar Cakung Gg. Taruna Rt. 006/02,Suka Pura,16106,,0,0,,,,,2
KB Ar-Ridwaniyah,69857207,2,Jl. Tipar Cakung Rt.006 Rw.002 No.22,Suka Pura,16106,,0,0,,,,,2
KB As Syifa,69821077,2,Jl. Tengah,Kramat Jati,16405,,0,0,,,,,2
KB Ash - Shalihin,69857192,2,WALANG BARU RAYA NO.25,Tugu Utara,16104,14260,0,0,021-43934216,214306811,bees-co@rad.net.id,,2
KB Ash-Shalihin,69795567,2,Walang Baru Raya No. 25,Tugu Utara,16104,,0,0,,,,,2
KB Assalam Hidir,69857232,2,Jl. Kalibaru Timur IV No.46,Kali Baru,16106,14110,0,0,021-44456079,,hidirindonesia@yahoo.co.id,,2
KB Assalam Hidir,69795518,2,Jl. Kalibaru Timur IV No. 46,Kali Baru,16106,,0,0,,,,,2
KB As-Syifa Djohar,69832215,2,JL ISA NO.71,Sukabumi Utara,16202,,0,0,,,,,2
KB Azzahrah,69856730,2,JL. TALI IX RT. 002 RW.09 NO.9,Kota Bambu Selatan,16203,11420,-6.187062,106.799641,0878-9066426,,paudazzahra.kbs@gmail.com,,2
KB Baburridho,69795522,2,Jl. Baru No. 52,Kali Baru,16106,14110,0,0,0818-07833622,0,darti.isyanti@yahoo.co.id,,2
KB Bahrul Ulum,69773332,2,MANGGA BESAR XIII,Mangga Dua Selatan,16007,,0,0,,,,,2
KB Baitul Ilmi,69880113,2,Jl. Bak Air II Rt 002 Rw 013 No. 28 Tg. Priok Jakarta Utara,Tanjung Priuk,16103,14310,-6.11794,106.872683,0852-83307631,,,,2
KB Baitul Mu Minin,69862372,2,JL. KP. SUKA TANI RT02 RW 02,Tegal Alur,16208,11820,0,0,0813-81373974,,mumin@gmail.com,,2
KB Baitul MyshawwirIIn,69857170,2,WARAKAS II NO.4 RT 003 RW 02,Warakas,16103,,0,0,,,,,2
KB Baitur Rahman,69795563,2,Komp. Green Garden B 16/21,Rorotan,16106,,0,0,,,,,2
KB Baytus Salam,69831060,2,POLTANGAN III NO.97,Pejaten Timur,16302,,0,0,,,,,2
KB Bee Audi,69856713,2,Joglo Baru,Joglo,16201,11640,-6.217704,106.720858,0812-19012010,,bee_audi@yahoo.co.id,,2
KB Beo Manis,69830166,2,Jl. Kober Pedati No. 30 Rt.07 Rw.02,Bali Mester,16406,,-6.222889,106.869587,,,,,2
KB Bhayangkari 2,69773297,2,Jl. Sultan Syahrir No. 1,Gondangdia,16002,,0,0,,,,,2
KB Bina Bangsa School,90101140,2,"JL. Budi Kav 87, Kemanggisan, Jakarta Barat, DKI Jakarta",Kemanggisan,16203,,0,0,,,,,2
KB Bina Lestari,69856725,2,JL.ANGGREK CENDRAWASIH GG B RT 002/RW 04,Kemanggisan,16203,,0,0,,,,,2
KB Bina Mandiri Sejahtera,69795745,2,Jl. Gading Kirana Utara Blok E 10 No. 28,Kelapa Gading Barat,16105,,0,0,,,,,2
KB Bina Nelayan Pesisir,69795592,2,Marunda Kongsi Rt. 005/007,Marunda,16106,,0,0,,,,,2
KB Bina Sejahtera I,69783471,2,JL. RADIO DALAM ANTENE VI,Gandaria Utara,16306,12140,0,0,021-7234655,,suparnoagus1952@gmail.com,,2
KB Bintang,69832233,2,Jl. Melati V RT04/09,Kapuk,16207,,0,0,,,,,2
KB Bintang Kecil,69795536,2,Tipar Timur,Semper Barat,16106,,0,0,,,,,2
KB Bintang Kecil,69857223,2,TIPAR TIMUR,Semper Barat,16106,,0,0,,,,,2
KB Bugenvil,69832219,2,kmpung bali no.41 rt.10 rw.05,Duri Kepa,16202,,0,0,,,,,2
KB Bunda Lestari,69795572,2,Sungai Brantas No. 6 Rt. 013/01,Semper Barat,16106,,0,0,,,,,2
KB Bunda Lestari,69857227,2,Sungai Brantas No.6 Rt.013 Rw.001,Semper Barat,16106,,0,0,,,,,2
KB Bunda Mulia School,69892391,2,Jl. Lodan Raya No 2,Ancol,16102,,0,0,,,,,2
KB Bunda Pekayon,69820760,2,JL. PENDIDIKAN NO 29 RT 04/09,Pekayon,16401,13710,-6.3431,106.8609,021-8706824,,tkkbbunda@gmail.com,,2
KB Bunga Mawar Pulau Untung Jawa,69768540,2,PULAU UNTUNG JAWA,Pulau Untung Jawa,10101,14510,0,0,0856-93230018,,kbbungamawar@gmail.com,,2
KB Bunga Sakura,69795584,2,Jl. Ananta Raya No. F6 13,Semper Barat,16106,,0,0,,,,,2
KB Cahaya Hati,69857198,2,Jl. Lagoa Terusan Gg.5 B2 No.19C Rt.07 Rw.04,Lagoa,16104,,0,0,,,,,2
KB Cahaya Prima,69832240,2,Jl. Pasar Timbul RT014/016,Kapuk,16207,11720,0,0,0813-18800657,,wutary915@gmail.com,,2
KB Cahaya Purnama,69857188,2,Kp.Bendungan Melayu no.30 Rt 010 Rw 02,Rawabadak Selatan,16104,,0,0,,,,,2
KB Cemara,69857195,2,JL. LONTAR TAMAN NO 11 RT 03/05,Tugu Utara,16104,14260,0,0,0813-18821117,,paudcemara55@yahoo.com,,2
KB Cerdas Hati,69795741,2,Jl. Italian Walk Blok J No. 29 Kelapa Gading Square,Kelapa Gading Barat,16105,,0,0,,,,,2
KB Ceria 03,69857222,2,Jl. Rekreasi No.3,Cilincing,16106,14120,0,0,0813-11625879,,,,2
KB Ceria Al-Amin,69795714,2,Ancol barat,Ancol,16102,,0,0,,,,,2
KB Ceria Nusantara,69857168,2,JL. WARAKAS 4 Gg 15 NO.29 RT 004/014,Warakas,16103,,0,0,,,,,2
KB Cikal,69795718,2,Jl. Ganggeng Raya No.33/82,Sungai Bambu,16103,,0,0,,,,,2
KB Daarun Najah,69857211,2,Jl. Tipar Cakung Rt.014 Rw.006 No.13,Suka Pura,16106,,0,0,,,,,2
KB Daarun Najah,69795685,2,Jl. Tipar Cakung Gg. H. Pitang Rt. 14/06 No. 13 Sukapura,Suka Pura,16106,,0,0,,,,,2
KB Daarut Taqwa,69832234,2,Kapuk Raya RT11/03 No 04,Kapuk,16207,,0,0,,,,,2
KB El Irhab,69856736,2,Jl Kp Menceng Rt08/05 No 90,Tegal Alur,16208,11820,-6.128383,106.719056,,,aisyahirhab123@gmail.com,,2
KB Fahman Jayyidan Pulau Panggang,69768541,2,PULAU PRAMUKA,Pulau Panggang,10102,,0,0,,,,,2
KB Fathonah,69832237,2,Melati 5 RT11/09 No 1,Kapuk,16207,,0,0,,,,,2
KB Glory Schhol,69857164,2,JL.SUNTER GARDEN BLOK B3 NO.10.B RT.005/018 KEL SUNTER AGUNG KEC.TANJUNG PRIOK J,Sunter Agung,16103,,0,0,,,,,2
KB Haniya,69857219,2,Jl. Sungai Tiram,Marunda,16106,14150,0,0,0818-815777,,paudhaniya@gmail.com,,2
KB Haniya,69795578,2,Sungai Tiram Gg. H. Abdul Rochim Rt. 008/011,Marunda,16106,,0,0,,,,,2
KB Harapan,69856731,2,JL.KOTA BAMBU UTARA I RT 013 RW 03 NO : 26 A,Kota Bambu Utara,16203,,0,0,,,,,2
KB Hikmatul Barokah,69857161,2,JL. ANCOL BARAT I/3 RT.006 RW.01,Ancol,16102,14430,0,0,0852-16443477,,fitriKU_susanti@yahoo.com,,2
KB Husna,69857184,2,Jl. Alur laut i gg IV no 53 Rt 04/03,Rawabadak Selatan,16104,14230,0,0,0813-15152308,,ratna_himpaudi@yahoo.co.id,,2
KB Husna,69795646,2,Jl. Alur Laut No. 53,Rawabadak Selatan,16104,,0,0,,,,,2
KB Ibnu Sabil,69857206,2,Jl. Tipar Cakung Rt.006 Rw.001,Suka Pura,16106,14140,0,0,0856-1277593,,nitamelannia161@gmail.com,,2
KB Ibnu Sabil,69795605,2,Kp. Sukapura . Tipar Cakung Rt. 06/01 No. 1,Suka Pura,16106,,0,0,,,,,2
KB Ibnu Shina,69856715,2,Jl.Mufakat No. 17 RT.3/06,Srengseng,16201,,-6.208394,106.758614,0813-15643371,,ihwankamil15@gmail.com,,2
KB Jayakarta,69857226,2,Jl. Sungai Barito No.14,Semper Barat,16106,,0,0,,,,,2
KB Jayakarta Montessori,69857866,2,JL KEMANG SELATAN I L-1,Bangka,16307,12730,0,0,021-7194907,,sita_rio6@yahoo.com,http://jktmontessori@yahoo.com,2
KB Kaledupa,69857167,2,WARAKAS III GANG 6/34,Warakas,16103,,0,0,,,,,2
KB Karina,69856723,2,JL.K.S TUBUN 3 NO.25 RT 004/02,Slipi,16203,,0,0,,,,,2
KB Kartini,69856732,2,Jl.Kota Bambu Utara,Kota Bambu Utara,16203,,0,0,,,,,2
KB Kasih Ananda III,69795661,2,Jl. Raya Cilincing Green Garden Pinang Sari IV,Rorotan,16106,,0,0,,,,,2
KB Kasih Ibu,69880121,2,Jl. Manggar No.9 Rt.003 Rw.011,Tugu Utara,16104,14260,0,0,0813-11662394,,birrulwalidaintugu@gmail.com,,2
KB Kelompok Bermain Lollypop,69773325,2,Jl. KH. Agus Salim No. 112 RT. 002 RW. 05,Gondangdia,16002,,0,0,,,,,2
KB Kemala Bhayangkari 01 Stik,69783556,2,JL. TIRTAYASA VII,Melawai,16306,,0,0,,,,,2
KB Kiddie Planet,69958469,2,Cluster Garden House Blok B No. 2-3 Bukit Golf  Mediterania,Kamal Muara,16101,,0,0,,,,,2
KB Kinderland,69831061,2,JL CARINGIN BARAT NO. 1,Cilandak Barat,16303,,0,0,,,,,2
KB Kinderland Preschool,69947879,2,Jl. Pakubuwono VINo.1 Rt.004/05,Gunung,16306,,0,0,,,,,2
KB Kindyroo Smart Start,69963105,2,Jl. Pluit Timur Raya Nomor 2 RT.006/005,Pluit,16101,,0,0,,,,,2
KB Kristen Ipeka Sunter,69909142,2,Jl. Agung Permai 15 Blok C Sunter Agung Tanjung Jakarta Utara,Sunter Agung,16103,,-6.141922,106.86484,,,,,2
KB Kristen VIII Bpk Penabur,69821018,2,JL. BIRU LAUT VIII NO.18 RT.007 RW.011,Cipinang Cempedak,16406,,0,0,,,,,2
KB Little Stars,69857181,2,JL. KMPG. BAHARI GG.III NO.239,Tanjung Priuk,16103,,-6.1301,106.8819,,,,,2
KB Lollikids Learning Centre,69820371,2,Jl. Asia Afrika,Gelora,16001,,0,0,,,,,2
KB Madani,69857200,2,Cikijang IV No.37 RT 006 RW 011,Koja,16104,14220,0,0,0812-8495560,0,yanto4768@gmail.com,,2
KB Madani,69795734,2,Jl. Cikijang IV No. 37 Rt. 006/011,Koja,16104,,0,0,,,,,2
KB Mafazah,69821103,2,Jl. Pondok Kelapa Selatan NO.21 A RT.003 Rw.12,Pondok Kelapa,16407,,0,0,,,,,2
KB Matahari,69865827,2,JL. PREPEDAN RAYA. NO. 57. RT.004.RW.007.,Kamal,16208,11810,-6.108884,106.703239,0878-30643817,,paud-matahari@yahoo.com.id,,2
KB Mawar,69857205,2,Jl. Lestari IX,Suka Pura,16106,14140,0,0,,,ernirahayu43@yahoo.com,,2
KB Mawar II,69795594,2,Lestari IX Rt. 003/010 o. 32,Suka Pura,16106,,0,0,,,,,2
KB Mekar Tanjung,69857169,2,Jl.Warakas VIII No.46 Rt.013/06,Warakas,16103,,-6.121279,106.876979,,,,,2
KB Melati,69795616,2,Jl. Pademangan Timur VI/77,Pademangan Timur,16102,,0,0,,,,,1
KB Mentari,69795579,2,Marunda Tiram No. 36 Rt. 10/02,Marunda,16106,,0,0,,,,,2
KB Mentari,69857217,2,Jl. Marunda Tiram No.36 Rt. 010 Rw.002,Marunda,16106,,0,0,,,,,2
KB Mustika,69857176,2,LAGOA KANAL ASRAMA CPM 10A RT 001/016,Kebon Bawang,16103,,-6.111934,106.887499,,,,,2
KB Mutiara,69795730,2,Jl. Kalibaru Barat IV,Kali Baru,16106,,0,0,,,,,2
KB Mutiara Bagi Bangsa,69795654,2,Jl. K NO.35 Gg - 35 HH,Pejagalan,16101,,0,0,,,,,2
KB Mutiara Hati,69795521,2,Jl. Cupang I No. 16 Rt. 05/012,Pejagalan,16101,,0,0,,,,,2
KB Mutiara Hati,69857157,2,JL. MOA BLOK B 18 NO. 2 B KAV RT. 010 RW. 013,Pejagalan,16101,14450,0,0,,,mutiarahati_pnfi@yahoo.co.id,,2
KB Mutiara Hati,69795527,2,Yos Sudarso Lorong 100 T No. 79,Koja,16104,14220,0,0,,,,,2
KB Negeri Tegal,69773323,2,Jl. Tegal No. 10,Menteng,16002,,0,0,,,,,1
KB Nur Al Fath,69795516,2,Perumahan Malaka Permai Rt. 018/06 No. 61,Rorotan,16106,,0,0,,,,,2
KB Nur Al Fath,69857212,2,Perum Malaka Permai,Rorotan,16106,,-6.146292,106.955352,,,,,2
KB Nur Amani,69821012,2,JL. SDN 01 PONDOK RANGGON  RT.004 RW.001,Pondok Ranggon,16403,13860,-6.342588,106.91476,021-22853621,,nur_amani81@yahoo.com,http://yayasan.annayyira.blogspot.com,2
KB Nurmaslia,69857220,2,Jl. Raya Cilincing,Cilincing,16106,,0,0,,,,,2
KB Nuroni,69856739,2,Kp Pinggir Rawa,Pegadungan,16208,11830,-6.125975,106.70318,,,cucunnuroni@gmail.com,,2
KB Nurul Ikhwan,69862366,2,JL.PREPEDAN DALAM,Kalideres,16208,11810,-6.114142,106.703253,0813-85869327,,,,2
KB Nurul Laili,69856726,2,JL. WULLUH II RT 002/007 NO.6,Kota Bambu Utara,16203,,0,0,,,,,2
KB PAUD Abc,69857163,2,Jl. Ancol Barat I,Ancol,16102,14430,0,0,0815-85075165,216906091,ika_wuryaningsih@yahoo.co.id,,2
KB PAUD Al Anwariyah Idris,69795641,2,Jl. Malaka I Rt.009 Rw.005,Rorotan,16106,14140,-6.1402,106.9552,0812-12755354,,alanwariyah504@gmail.com,,2
KB PAUD Al Anwariyah Idris,69857216,2,Jl. Malaka I Rt.009 Rw.005,Rorotan,16106,,0,0,,,,,2
KB PAUD Al Barokah,69795505,2,Jl. Cipeucang I No. 53 Rt. 003/013,Koja,16104,,0,0,,,,,2
KB PAUD Al Fauzaniyyah,69912051,2,Jl. STM Walang Jaya Rt.09 Rw.01,Tugu Selatan,16104,14260,0,0,0812-10646027,,Nena_Rusdaina@gmail.com,,2
KB PAUD Amanah,69857215,2,Jl. Rorotan Gg. IX No.48 Rt.008 Rw.007,Rorotan,16106,,0,0,021-44853177,,,,2
KB PAUD Anyelir 010,69773328,2,Gg. Dahlan 1 No. 30 A RT. 001 RW. 010,Cempaka Putih Barat,16005,,0,0,,,,,2
KB PAUD Arrahman,69857214,2,Komp. Green Garden B16 No.21,Rorotan,16106,,0,0,,,,,2
KB PAUD Ash Solihin,69857204,2,Jl. Raya Gading Mas Barat IV B8 17,Pegangsaan Dua,16105,14250,0,0,,,,,2
KB PAUD Asshobirin,69857233,2,Jl. Kalibaru Timur V Rt.001 Rw.013,Kali Baru,16106,14110,-6.099768,106.931714,021-4409750,,,,2
KB PAUD Baburridho,69857231,2,Jl. Baru,Kali Baru,16106,,-6.1217,106.925,,,,,2
KB PAUD Bintang,69857193,2,"Gedung PKG, Jl. Kramat Jaya Komp. Deperla RW 014",Tugu Utara,16104,,0,0,,,,,2
KB PAUD Bintang,69795559,2,Jl. Kramat jaya Komp. Deperla Ged. PKG,Tugu Utara,16104,,0,0,,,,,2
KB PAUD Bunga Sakura,69857225,2,ANANTA RAYA NO FG 13 RT 011/02,Semper Barat,16106,14130,-6.13632,106.923119,,,,,2
